Title,Keyword Used,Company,Area,Posted On,Number of Applicants,Seniority level,Employment type,Job function,Industries
"Data Engineer, Product Analytics",data analyst,Meta,"San Francisco, CA",5 hours ago,71 applicants,Not Applicable,Full-time,Information Technology,"Technology, Information and Internet"
"Senior Analyst, Business Analytics",data analyst,CVS Health,"Austin, TX",5 hours ago,,Not Applicable,Full-time,Analyst and Information Technology,Hospitals and Health Care
Staff Data Engineer (Mailchimp),data analyst,Intuit,"New York, NY",22 hours ago,28 applicants,Mid-Senior level,Full-time,Information Technology,Software Development
"Senior Healthcare Data Analyst, Analytics Hub",data analyst,ECG Management Consultants,"Seattle, WA",22 hours ago,178 applicants,Associate,Full-time,Information Technology,Business Consulting and Services and Hospitals and Health Care
Data Engineer (multiple openings) - IHM,data analyst,Discover Financial Services,"Riverwoods, IL",5 hours ago,,Mid-Senior level,Full-time,Information Technology,"Financial Services, Banking, and Hospitality"
Senior Enterprise Data Analyst,data analyst,HRUCKUS,"Washington, DC",16 hours ago,,Mid-Senior level,Full-time,Information Technology,IT Services and IT Consulting and Business Consulting and Services
Data Analyst supporting the ATF,data analyst,FSA,"Washington, DC",2 hours ago,,Entry level,Full-time,Information Technology,Government Administration
Data Analyst II - Iowa Nutrient Reduction Strategy,data analyst,Iowa State University,"Ames, IA",21 hours ago,37 applicants,Mid-Senior level,Full-time,Information Technology,Higher Education
Sr. Analytics Developer,data analyst,Capleo Global,"Atlanta, GA",20 hours ago,,Mid-Senior level,Full-time,Engineering and Information Technology,Business Consulting and Services
Data Analyst (secret clearance),data analyst,Dice,"Washington, DC",22 hours ago,27 applicants,Mid-Senior level,Full-time,Information Technology,Software Development
Sr. Data Engineer,data analyst,ActiveProspect,"Philadelphia, PA",13 hours ago,43 applicants,Mid-Senior level,Full-time,Information Technology,Internet Publishing
BI Analyst III,data analyst,VCU Health,"Richmond, VA",16 hours ago,26 applicants,Mid-Senior level,Full-time,"Research, Analyst, and Information Technology",Hospitals and Health Care
Performance Analyst,data analyst,PRIME,"Miami, FL",19 hours ago,142 applicants,Associate,Full-time,Analyst,"Technology, Information and Internet"
Real-Time Analyst,data analyst,PartnerHero,United States,23 hours ago,113 applicants,Mid-Senior level,Full-time,Project Management and Information Technology,Outsourcing and Offshoring Consulting
Python Data Engineer - Onsite Lead,data analyst,Persistent Systems,"Dallas, TX",,132 applicants,Mid-Senior level,Full-time,Information Technology,IT Services and IT Consulting
Data Deficiency Analyst,data analyst,Wells Fargo,"Charlotte, NC",10 hours ago,,Associate,Full-time,Research and Analyst,"Financial Services, Investment Management, and Banking"
Sr. Data Engineer,data analyst,ActiveProspect,"Austin, TX",14 hours ago,58 applicants,Mid-Senior level,Full-time,Information Technology,Internet Publishing
Data Engineer,data analyst,DISH Network,"Littleton, CO",5 hours ago,,Not Applicable,Full-time,Information Technology,Telecommunications
Data Engineer,data analyst,VanderHouwen,"Portland, OR",10 hours ago,,Mid-Senior level,Full-time,Information Technology,Staffing and Recruiting
"Analyst, Business Systems",data analyst,myGwork - LGBTQ+ Business Community,"Orange, CT",2 hours ago,,Mid-Senior level,Full-time,Information Technology,Utilities
System Engineer,data analyst,Toyota Industries Group TACG-TICA,"Pendergrass, GA",16 hours ago,31 applicants,Associate,Full-time,Information Technology,Motor Vehicle Parts Manufacturing
Data Engineer,data analyst,Healthfirst,"New York, United States",14 hours ago,59 applicants,Not Applicable,Full-time,Information Technology,Hospitals and Health Care
Data Protection Analyst,data analyst,Mueller Water Products,"Atlanta, GA",10 hours ago,26 applicants,Entry level,Full-time,Engineering and Information Technology,"Appliances, Electrical, and Electronics Manufacturing and Utilities"
Junior IT Analyst,data analyst,CAI,"Allentown, PA",21 hours ago,132 applicants,Entry level,Full-time,Information Technology,IT Services and IT Consulting
Business Intelligence Analyst- Claims Transformation,data analyst,Central Insurance,"Waltham, MA",16 hours ago,42 applicants,Entry level,Full-time,"Research, Analyst, and Information Technology",Insurance
Product Master Data IT - Functional Analyst,data analyst,Hewlett Packard Enterprise,"Texas, United States",17 hours ago,,Not Applicable,Full-time,Information Technology,IT Services and IT Consulting
Power BI/Tableau/Alteryx Analyst,data analyst,Dice,United States,22 hours ago,49 applicants,Entry level,Full-time,Business Development and Sales,Software Development
Sr. Data Engineer,data analyst,Anblicks,"Dallas, TX",21 hours ago,,Mid-Senior level,Full-time,"Design, Information Technology, and Engineering","IT Services and IT Consulting, Design Services, and Engineering Services"
IT Engineer -Data Center Operation ,data analyst,Contemporary Amperex Technology Kentucky LLC,"Michigan, United States",19 hours ago,33 applicants,Not Applicable,Full-time,Information Technology,Motor Vehicle Manufacturing
Data Engineer,data analyst,Healthfirst,"Texas, United States",20 hours ago,178 applicants,Not Applicable,Full-time,Information Technology,Hospitals and Health Care
Data Engineer,data analyst,Healthfirst,"Florida, United States",20 hours ago,160 applicants,Not Applicable,Full-time,Information Technology,Hospitals and Health Care
Business Systems Analyst,data analyst,System One,"Pittsburgh, PA",22 hours ago,,Associate,Full-time,Information Technology,"IT Services and IT Consulting, Software Development, and Computer and Network Security"
OSINT Analyst - Junior,data analyst,"Bluehawk LLC, Intelligence Services","Scott AFB, IL",18 hours ago,,Mid-Senior level,Full-time,Business Development and Sales,Defense and Space Manufacturing
OSINT Analyst - Junior,data analyst,"Bluehawk LLC, Intelligence Services","Scott AFB, IL",18 hours ago,,Mid-Senior level,Full-time,Business Development and Sales,Defense and Space Manufacturing
"Women, Peace, and Security Data Analyst",data analyst,Q2 Impact,"Arlington, VA",18 hours ago,,Mid-Senior level,Full-time,Information Technology,International Trade and Development
Data Engineer,data analyst,Healthfirst,"Connecticut, United States",14 hours ago,,Not Applicable,Full-time,Information Technology,Hospitals and Health Care
"Systems Engineer, Majors",data analyst,Palo Alto Networks,"Detroit, MI",18 hours ago,,Associate,Full-time,Sales,Computer and Network Security
Oracle Data Warehouse and BI Analyst,data analyst,Guidehouse,"New York, NY",5 hours ago,36 applicants,Mid-Senior level,Full-time,"Research, Analyst, and Information Technology",Business Consulting and Services
Forensic Data Analyst (Ability to obtain/maintain Public Trust),data analyst,Akima,"Arlington, VA",10 hours ago,,Mid-Senior level,Full-time,Information Technology,Consumer Services
GIS Analyst,data analyst,Leidos,"Chantilly, VA",8 hours ago,,Entry level,Full-time,Legal,IT Services and IT Consulting
GIS Analyst,data analyst,Leidos,"Chantilly, VA",8 hours ago,,Entry level,Full-time,Legal,IT Services and IT Consulting
Team Lead/Senior Information Systems Security Analyst (ISSA),data analyst,"Spry Methods, Inc.","Washington, DC",14 hours ago,,Not Applicable,Full-time,Information Technology,Information Technology & Services
Data Engineer-  Hybrid / Remote,data analyst,BigBear.ai,"Arlington, VA",16 hours ago,104 applicants,Not Applicable,Full-time,Engineering,Software Development
Advisory Data/Reporting Analyst,data analyst,FTI - Frontier Technology Inc,"Arlington, VA",15 hours ago,,Mid-Senior level,Full-time,"Research, Analyst, and Information Technology",Defense and Space Manufacturing
Databricks Engineer,data analyst,Proven Recruiting,"Phoenix, AZ",9 hours ago,,Mid-Senior level,Full-time,Engineering and Information Technology,Staffing and Recruiting
Data Engineer - Senior,data analyst,Republic National Distributing Company,"Atlanta, GA",21 hours ago,,Mid-Senior level,Full-time,Information Technology,Beverage Manufacturing
Senior Analytics Engineer 1,data analyst,The Farmer's Dog,"New York, NY",21 hours ago,65 applicants,Mid-Senior level,Full-time,Information Technology,Manufacturing
Cyber Crimes Intel Senior Analyst,data analyst,Truist,"Atlanta, GA",22 hours ago,,Not Applicable,Full-time,"Other, Information Technology, and Management",Financial Services
SR. DATA SCIENCIST,data analyst,Keylent Inc,"Plano, TX",10 hours ago,,Entry level,Full-time,Information Technology,Information Technology & Services
"Data Engineer, GSF",data analyst,Amazon,"Austin, TX",4 hours ago,,Not Applicable,Full-time,"Distribution, Supply Chain, and Engineering",Software Development
"Customer Engineer, Data Analytics, Startups, Google Cloud",data analyst,Google,"Sunnyvale, CA",5 hours ago,45 applicants,Not Applicable,Full-time,"Project Management, Consulting, and Engineering","Information Services and Technology, Information and Internet"
Analysts,data analyst,Rangam,"McLean, VA",1 hour ago,,Associate,Full-time,Information Technology and Analyst,Financial Services
Database Developer,data analyst,Phoenix Recruitment,"Jacksonville, FL",6 hours ago,,Entry level,Full-time,Information Technology,Software Development
Data Management Business Analyst,data analyst,Talent Groups,"Dallas, TX",23 hours ago,36 applicants,Mid-Senior level,Full-time,Information Technology,Staffing and Recruiting
Electronic Data Interchange Analyst,data analyst,"1-800-FLOWERS.COM, INC.","Medford, OR",17 hours ago,,Associate,Full-time,Information Technology,Retail
Data Engineer,data analyst,Compunnel Inc.,"Minneapolis, MN",6 hours ago,,Mid-Senior level,Full-time,Information Technology,IT Services and IT Consulting
"CBA Data Analyst-NALCOMIS Administrator - F-5 - NAS Fallon, NV",data analyst,V2X Inc,"Fallon, NV",15 hours ago,,Entry level,Full-time,Information Technology,Defense and Space Manufacturing
Data Center Engineer,data analyst,Latitude Inc,"Kansas, United States",14 hours ago,,Not Applicable,Full-time,Information Technology,Staffing and Recruiting
System Engineer,data analyst,Connect-IT,"Manhattan, NY",5 hours ago,,Mid-Senior level,Full-time,Information Technology,IT Services and IT Consulting
"Data Engineering Leader, Analytics (AI Training, PyTorch)",data analyst,Meta,"Menlo Park, CA",5 hours ago,,Not Applicable,Full-time,Information Technology,"Technology, Information and Internet"
Data Engineer Level 2,data analyst,Compunnel Inc.,"Cincinnati, OH",18 hours ago,,Entry level,Full-time,Information Technology,IT Services and IT Consulting
Retail Business Analyst,data analyst,Spherion Staffing New Jersey,"Asbury Park, NJ",14 hours ago,56 applicants,Mid-Senior level,Full-time,"Accounting/Auditing, Business Development, and Supply Chain",Retail
Data Management Analyst - Systems Integrator,data analyst,SAIC,"Chantilly, VA",3 hours ago,,Mid-Senior level,Full-time,Information Technology,"Computer Hardware Manufacturing, Defense and Space Manufacturing, and IT Services and IT Consulting"
"Sr. BSA (BI / Analytics) - CFH - 6 months - Oak Brook, Illinois",data analyst,"Resource 1, Inc.","Oak Brook, IL",19 hours ago,,Mid-Senior level,Full-time,"Analyst, Design, and General Business","Appliances, Electrical, and Electronics Manufacturing, Manufacturing, and IT System Design Services"
Data Engineer V,data analyst,Aditi Consulting,"New York, NY",17 hours ago,86 applicants,Mid-Senior level,Full-time,Information Technology,IT Services and IT Consulting
"Data Processing Technician, Mid",data analyst,Booz Allen Hamilton,"Aurora, CO",5 hours ago,36 applicants,Not Applicable,Full-time,Information Technology,IT Services and IT Consulting
Business Intelligence Analyst I (Mid-level),data analyst,Jobs via eFinancialCareers,"Phoenix, AZ",23 hours ago,,Mid-Senior level,Full-time,"Research, Analyst, and Information Technology",Staffing and Recruiting
Sr. Data Engineer,data analyst,PRI Global,"Hershey, PA",19 hours ago,,Mid-Senior level,Full-time,Other,IT Services and IT Consulting
Data Analytics Sr Developer,data analyst,Solventum,"Minnesota, United States",4 hours ago,,Mid-Senior level,Full-time,Information Technology,Medical Equipment Manufacturing
Data Engineer - AWS,data analyst,DRC Systems,"Connecticut, United States",13 hours ago,,Mid-Senior level,Full-time,Information Technology,IT Services and IT Consulting
DATA ANALYST III HEALTHCARE ANALYTICS,data analyst,Dice,"Miami, FL",23 hours ago,,Mid-Senior level,Full-time,Information Technology,Software Development
DATA ANALYST III HEALTHCARE ANALYTICS,data analyst,Dice,"Hialeah, FL",23 hours ago,,Mid-Senior level,Full-time,Information Technology,Software Development
PM/Data Analyst,data analyst,Dice,"New York, NY",22 hours ago,,Mid-Senior level,Full-time,Project Management and Information Technology,Software Development
"Business Intel Engineer, Grocery Data Tech Analytics",data analyst,Amazon,"Seattle, WA",4 hours ago,54 applicants,Not Applicable,Full-time,"Strategy/Planning, Analyst, and Information Technology",Software Development
Senior Data Engineer,data analyst,Truist,"Denver, CO",10 hours ago,,Not Applicable,Full-time,Information Technology,Financial Services
Data Scientist - Poe (Remote),data analyst,Quora,"Austin, TX",17 hours ago,,Mid-Senior level,Full-time,Engineering and Information Technology,"Technology, Information and Internet"
Infrastructure Engineer,data analyst,Medix™,"Fort Wayne, IN",20 hours ago,25 applicants,Mid-Senior level,Full-time,Information Technology,Staffing and Recruiting
"Sr. Analyst, Workday – Data Governance & HCM",data analyst,CSL,"King of Prussia, PA",10 hours ago,,Not Applicable,Full-time,Information Technology,Biotechnology Research
"Senior Staff Data Scientist, Risk Analytics Models",data analyst,SoFi,"San Francisco, CA",5 hours ago,100 applicants,Not Applicable,Full-time,Engineering and Information Technology,Financial Services
IT Systems Engineer (Manufacturing),data analyst,Contemporary Amperex Technology Kentucky LLC,"Michigan, United States",19 hours ago,,Not Applicable,Full-time,Information Technology and Engineering,Motor Vehicle Manufacturing
Senior Data Engineer,data analyst,Insight Global,Atlanta Metropolitan Area,,154 applicants,Mid-Senior level,Full-time,Information Technology,IT Services and IT Consulting and Staffing and Recruiting
Statistician Intermediate,data analyst,Michigan Medicine,"Ann Arbor, MI",11 hours ago,,Entry level,Full-time,"Research, Analyst, and Information Technology",Hospitals and Health Care
Founding AI Engineer (LLM),data analyst,Greylock,"San Francisco, CA",17 hours ago,86 applicants,Mid-Senior level,Full-time,Engineering and Information Technology,"Software Development and Technology, Information and Internet"
ERP Business Systems Analyst / ERP Business Analyst / Infor Syteline BSA 24-13022,data analyst,"TeamBradley, Inc.","Spring, TX",19 hours ago,31 applicants,Mid-Senior level,Full-time,Engineering and Information Technology,Industrial Machinery Manufacturing and Manufacturing
Cloud Support Engineer,data analyst,Trusted Tech Team,"Irvine, CA",16 hours ago,,Mid-Senior level,Full-time,"Information Technology, Customer Service, and Consulting",IT Services and IT Consulting
Google Analytics Specialist,data analyst,Dice,United States,22 hours ago,,Mid-Senior level,Full-time,"Research, Analyst, and Information Technology",Software Development
Senior Information Technology Analyst,data analyst,Comrise,"Hanover, MD",20 hours ago,44 applicants,Mid-Senior level,Full-time,Engineering and Information Technology,IT Services and IT Consulting
Systems Engineer - Senior II - ESE04,data analyst,Solutions³ LLC,"Pensacola, FL",19 hours ago,,Mid-Senior level,Full-time,Information Technology,Internet Publishing
Senior Data Modeler,data analyst,Sherwin-Williams,"Cleveland, OH",21 hours ago,,Mid-Senior level,Full-time,Information Technology,Chemical Manufacturing and Manufacturing
Business Insights Engineer,data analyst,ChampionX,"Sugar Land, TX",16 hours ago,,Not Applicable,Full-time,Marketing,Oil and Gas
Data Analytics & Cloud Solutions Engineer,data analyst,Tata Consultancy Services,"Bellevue, WA",4 hours ago,98 applicants,Entry level,Full-time,Engineering and Information Technology,IT Services and IT Consulting
DATA Center Critical Systems Engineer-Washington D,data analyst,Cogent Communications,"Washington, DC",3 hours ago,,Mid-Senior level,Full-time,Information Technology,Telecommunications
Senior Data Engineer,data analyst,Caterpillar Inc.,"Chicago, IL",11 hours ago,,Not Applicable,Full-time,Information Technology,Construction and Machinery Manufacturing
Systems Engineer (Hybrid),data analyst,NCSA College Recruiting,United States,17 hours ago,,Mid-Senior level,Full-time,Information Technology,Consumer Services
TM1 Developer (Planning and Analytics),data analyst,HEICO,"Hollywood, FL",17 hours ago,,Mid-Senior level,Full-time,Information Technology and Accounting/Auditing,Aviation and Aerospace Component Manufacturing
System Engineer,data analyst,Karpel Solutions,"St Louis, MO",4 hours ago,,Mid-Senior level,Full-time,Information Technology,IT Services and IT Consulting
"Sr. Analyst, Data Governance",data analyst,Oil and Gas Job Search Ltd,"Houston, TX",6 hours ago,,Mid-Senior level,Full-time,Information Technology,Oil and Gas
"Data Engineer, Ops Finance Transportation",data analyst,Amazon,"Bellevue, WA",4 hours ago,75 applicants,Not Applicable,Full-time,Information Technology,Software Development
Entry Level Application Engineer - 2025 Start Date,data analyst,Vanguard,"Malvern, PA",23 hours ago,183 applicants,Associate,Full-time,Engineering and Information Technology,Financial Services
Market Data Specialist I,data analyst,Dice,United States,23 hours ago,,Entry level,Full-time,Information Technology,Software Development
Data Management Analyst,data analyst,Dice,"Charlotte, NC",22 hours ago,,Mid-Senior level,Full-time,Information Technology,Software Development
2025 University Graduate - Machine Learning Engineer,data analyst,Adobe,"San Jose, CA",10 hours ago,71 applicants,Entry level,Full-time,Engineering and Information Technology,"Advertising Services, IT Services and IT Consulting, and Software Development"
Business Intelligence Developer II,data analyst,Bexar County Information Technology,"San Antonio, Texas Metropolitan Area",22 hours ago,,Associate,Full-time,Information Technology,Government Administration
Data Center Engineer II,data analyst,Children's National Hospital,"Silver Spring, MD",10 hours ago,,Mid-Senior level,Full-time,Information Technology,Hospitals and Health Care
Database Engineer,data analyst,Dice,United States,22 hours ago,27 applicants,Entry level,Full-time,Information Technology,Software Development
Data Integration Engineer- Hybrid - 5359,data analyst,Benchmark IT - Technology Talent,"New York, NY",23 hours ago,194 applicants,Mid-Senior level,Full-time,Information Technology,"Technology, Information and Media"
Systems Engineer (Hybrid),data analyst,NCSA College Recruiting,"Bradenton, FL",17 hours ago,,Mid-Senior level,Full-time,Information Technology,Consumer Services
"Business Analyst, Corporate IT",data analyst,Sony Pictures Entertainment,"Culver City, CA",22 hours ago,53 applicants,Mid-Senior level,Full-time,"Research, Analyst, and Information Technology",Entertainment Providers
Civic Analytics Analyst,data analyst,City of Sioux Falls,"Sioux Falls, SD",22 hours ago,,Mid-Senior level,Full-time,Business Development and Sales,"Government Administration, Executive Offices, and Government Relations Services"
Data Analyst Manager,data analyst,Recruiting from Scratch,"Los Angeles County, CA",11 hours ago,,Mid-Senior level,Full-time,Information Technology,Staffing and Recruiting
"System Admin/Engr I, Alexa Devices",data analyst,Amazon Lab126,"Sunnyvale, CA",14 hours ago,,Not Applicable,Full-time,"Quality Assurance, Information Technology, and Engineering",Computers and Electronics Manufacturing
Quantitative Developer,data analyst,Next Ventures,"New York, NY",18 hours ago,82 applicants,Mid-Senior level,Full-time,Engineering and Information Technology,"IT Services and IT Consulting, Financial Services, and Business Consulting and Services"
Data Engineer with Kafka,data analyst,Bitwise Inc,"Schaumburg, IL",21 hours ago,169 applicants,Mid-Senior level,Full-time,Information Technology and Engineering,IT Services and IT Consulting and Financial Services
100% Remote Sr. SAS Programmer (R Programming & Macros Expert),data analyst,Maxis Clinical Sciences,"Pleasanton, CA",1 hour ago,,Mid-Senior level,Full-time,Information Technology,Strategic Management Services
Data Engineer II,data analyst,Centene Corporation,"Pennsylvania, United States",16 hours ago,65 applicants,Not Applicable,Full-time,Information Technology,Insurance and Hospitals and Health Care
Senior Healthcare Analytics & Reporting Consultant,data analyst,Health Care Service Corporation,"Dallas, TX",5 hours ago,99 applicants,Not Applicable,Full-time,Finance and Sales,Insurance and Hospitals and Health Care
Data Engineer - TS/SCI FS Poly clearance required - Data Engineering/ Data science/Software Engineering ,data analyst,RJI Search,"McLean, VA",20 hours ago,45 applicants,Entry level,Full-time,Information Technology and Engineering,Government Administration and Government Relations Services
Junior Infrastructure Engineer,data analyst,Epic,"San Jose, CA",4 hours ago,35 applicants,Entry level,Full-time,Information Technology,"Computer Networking, Computer and Network Security, and Information Technology & Services"
Data Engineer - TS/SCI FS Poly clearance required - Data Engineering/ Data science/Software Engineering ,data analyst,RJI Search,"McLean, VA",20 hours ago,40 applicants,Entry level,Full-time,Information Technology and Engineering,Government Relations Services and Government Administration
NetSuite Business Systems Analyst,data analyst,Oscar,"New York, NY",18 hours ago,26 applicants,Mid-Senior level,Full-time,Information Technology,"Technology, Information and Media"
AI/ML Engineer,data scientist,CBC,"Virginia Beach, VA",6 hours ago,,Entry level,Full-time,Engineering and Information Technology,IT Services and IT Consulting
Machine Learning Engineer - AI/ML,data scientist,Eightfold,"Santa Clara, CA",2 hours ago,,Internship,Full-time,Engineering,Software Development
Junior Data Scientist,data scientist,Team Remotely Inc,"Nashville, TN",6 hours ago,,Entry level,Full-time,Information Technology,Software Development
Data Scientist,data scientist,ActiveProspect,"Philadelphia, PA",14 hours ago,55 applicants,Mid-Senior level,Full-time,Engineering and Information Technology,Internet Publishing
Data Scientist,data scientist,ActiveProspect,"Austin, TX",14 hours ago,45 applicants,Mid-Senior level,Full-time,Engineering and Information Technology,Internet Publishing
"Data Scientist, Product Analytics",data scientist,Etsy,"Brooklyn, NY",19 hours ago,,Entry level,Full-time,Engineering and Information Technology,Software Development
"Data Scientist, Marketing, Google Cloud",data scientist,Google,"Sunnyvale, CA",15 hours ago,81 applicants,Not Applicable,Full-time,"Sales, Advertising, and Marketing","Information Services and Technology, Information and Internet"
Data Scientist,data scientist,BetterHelp,"Mountain View, CA",21 hours ago,,Mid-Senior level,Full-time,Engineering and Information Technology,Primary and Secondary Education and Non-profit Organizations
"Data Scientist, Decisions, Rider Experience",data scientist,Lyft,"Seattle, WA",16 hours ago,38 applicants,Mid-Senior level,Full-time,Engineering and Information Technology,Ground Passenger Transportation
"Healthcare Data Scientist - Machine Learning/AI, Statistics, Operations Research",data scientist,University of Maryland Medical System,"North Bethesda, MD",22 hours ago,56 applicants,Entry level,Full-time,Other,Hospitals and Health Care
"Data Scientist, Marketing, Google Cloud",data scientist,Google,"Bellevue, WA",15 hours ago,54 applicants,Not Applicable,Full-time,"Sales, Advertising, and Marketing","Information Services and Technology, Information and Internet"
Data Scientist - Demand Forecasting,data scientist,Tiger Analytics,"New Jersey, United States",6 hours ago,40 applicants,Mid-Senior level,Full-time,Analyst,Primary and Secondary Education and Non-profit Organizations
Data Scientist,data scientist,Avance Consulting,"Denver, CO",1 hour ago,,Mid-Senior level,Full-time,Engineering and Information Technology,Staffing and Recruiting
Data Scientist,data scientist,Adobe,"New York, NY",5 hours ago,,Mid-Senior level,Full-time,Engineering and Information Technology,"IT Services and IT Consulting, Advertising Services, and Software Development"
"Data Scientist, GBG Data Science",data scientist,Meta,"Menlo Park, CA",5 hours ago,130 applicants,Not Applicable,Full-time,Engineering and Information Technology,"Technology, Information and Internet"
Machine Learning Engineer - New Verticals,data scientist,DoorDash,"Sunnyvale, CA",5 hours ago,,Entry level,Full-time,Engineering and Information Technology,Software Development
"Data Scientist, Growth",data scientist,Hinge,"New York, NY",16 hours ago,,Mid-Senior level,Full-time,Engineering,Software Development
Data Scientist,data scientist,Adobe,"San Jose, CA",5 hours ago,,Mid-Senior level,Full-time,Engineering and Information Technology,"IT Services and IT Consulting, Advertising Services, and Software Development"
Data Scientist,data scientist,Stripe,"Chicago, IL",5 hours ago,,Mid-Senior level,Full-time,Engineering and Information Technology,"Software Development, Technology, Information and Internet, and Financial Services"
