Title,Keyword Used,Company,Area,Posted On,Number of Applicants,Seniority level,Employment type,Job function,Industries
Data Analyst,data analyst,Hirewell,Cincinnati Metropolitan Area,15 hours ago,,Mid-Senior level,Full-time,"Information Technology, Analyst, and Customer Service","Transportation, Logistics, Supply Chain and Storage, Electric Power Transmission, Control, and Distribution, and Alternative Fuel Vehicle Manufacturing"
Data Analyst,data analyst,EnableComp,United States,3 hours ago,,Entry level,Full-time,Information Technology,Hospitals and Health Care
Data Analyst,data analyst,"Software Professionals, Inc.","Texas, United States",21 hours ago,,Associate,Full-time,Information Technology,IT Services and IT Consulting
Data Analyst,data analyst,Coders Data,"Atlanta, GA",15 hours ago,,Entry level,Full-time,Information Technology,IT Services and IT Consulting
Data Analyst,data analyst,Addison Group,"Denver, CO",17 hours ago,,Mid-Senior level,Full-time,Analyst,Banking and Financial Services
Junior Data Analyst,data analyst,Team Remotely Inc,"Nashville, TN",6 hours ago,,Entry level,Full-time,Information Technology,Software Development
Data Analyst,data analyst,Finfare,"Irvine, CA",15 hours ago,,Mid-Senior level,Full-time,Information Technology,Financial Services
Data Analyst,data analyst,Laserfiche,"Long Beach, CA",4 hours ago,,Entry level,Full-time,Information Technology,Software Development
Data Analyst,data analyst,System Soft Technologies,"Fort Worth, TX",21 hours ago,,Mid-Senior level,Full-time,Information Technology,IT Services and IT Consulting
Business Data Analyst ( Fulltime Job) ,data analyst,Tech Mahindra,"New Jersey, United States",18 hours ago,194 applicants,Mid-Senior level,Full-time,Finance,IT Services and IT Consulting and Banking
Data Analyst,data analyst,AEG,"Los Angeles, CA",4 hours ago,,Mid-Senior level,Full-time,Information Technology,Entertainment Providers
Business Data Analyst,data analyst,Dexian,"Irving, TX",21 hours ago,,Mid-Senior level,Full-time,"Analyst, Management, and Information Technology","Banking, Financial Services, and Investment Banking"
Data Analyst II,data analyst,Ampcus Inc,"Seattle, WA",10 hours ago,,Entry level,Full-time,Information Technology,IT Services and IT Consulting
Data Analyst,data analyst,CyberCoders,"La Puente, CA",4 hours ago,,Mid-Senior level,Full-time,Information Technology,Retail Apparel and Fashion
Data Analyst,data analyst,Luxoft,"Los Angeles, CA",47 minutes ago,52 applicants,Mid-Senior level,Full-time,Consulting,IT Services and IT Consulting
Junior Data Analyst (onsite),data analyst,Donnelly & Moore Corporation,"New York, NY",23 hours ago,,Mid-Senior level,Full-time,Other,IT Services and IT Consulting
Junior Data analyst,data analyst,"Global Channel Management, Inc.","Framingham, MA",20 hours ago,,Entry level,Full-time,Information Technology,Staffing and Recruiting
Business Data Analyst,data analyst,Federal Energy Regulatory Commission,United States,21 hours ago,,Mid-Senior level,Full-time,Analyst,Government Administration
Data Analyst II,data analyst,Intelliswift Software,"Seattle, WA",10 hours ago,,Entry level,Full-time,Information Technology,Information Technology & Services
Data Analyst-NY,data analyst,ATC,"New York, United States",1 hour ago,52 applicants,Entry level,Full-time,Information Technology,IT Services and IT Consulting
Data Analyst,data analyst,Epsilon,"Irvine, CA",5 hours ago,,Associate,Full-time,Marketing,"Software Development, IT Services and IT Consulting, and Advertising Services"
Data Analyst,data analyst,Cleveland Clinic,"Cleveland, OH",14 hours ago,,Mid-Senior level,Full-time,Information Technology,Hospitals and Health Care
Data Analyst-WA,data analyst,ATC,"Washington, United States",1 hour ago,48 applicants,Entry level,Full-time,Information Technology,IT Services and IT Consulting
Senior Data Analyst - Marketing,data analyst,SeatGeek,United States,10 hours ago,101 applicants,Mid-Senior level,Full-time,Information Technology,"Technology, Information and Internet"
Senior Data Analyst,data analyst,Forsyth Barnes,"Cleveland, OH",15 hours ago,102 applicants,Associate,Full-time,Analyst,Retail
Data Analyst,data analyst,eTeam,"San Francisco, CA",21 hours ago,,Entry level,Full-time,Information Technology,Staffing and Recruiting
Data Analyst I,data analyst,Ortho Molecular Products,"Stevens Point, WI",18 hours ago,,Entry level,Full-time,Information Technology,Wellness and Fitness Services
"Senior Data Analyst, Strategic Pricing",data analyst,Realtor.com,"Austin, TX",5 hours ago,,Not Applicable,Full-time,Information Technology,"IT Services and IT Consulting, Advertising Services, and Technology, Information and Internet"
Data Analyst-Tx,data analyst,ATC,"Texas, United States",1 hour ago,52 applicants,Entry level,Full-time,Information Technology,IT Services and IT Consulting
Data Analyst,data analyst,Federal Express Corporation,"Plano, TX",19 hours ago,,Entry level,Full-time,Information Technology,Freight and Package Transportation
Data Reporting Analyst,data analyst,Logitech,United States,16 hours ago,,Not Applicable,Full-time,"Design, Information Technology, and Engineering","IT Services and IT Consulting, Design Services, and Computers and Electronics Manufacturing"
Senior Data Analyst,data analyst,Aditi Consulting,United States,14 hours ago,,Mid-Senior level,Full-time,Information Technology,IT Services and IT Consulting and Insurance
Data Analyst 1,data analyst,Ampcus Inc,"Malvern, PA",10 hours ago,,Entry level,Full-time,Information Technology,"Appliances, Electrical, and Electronics Manufacturing"
Data Analyst- Junior- Full Time - Remote,data analyst,Opinion Focus Panel LLC,"California, United States",10 hours ago,,Not Applicable,Full-time,Information Technology,Market Research
Data Analyst,data analyst,SPECTRAFORCE,"Richland, WA",16 hours ago,85 applicants,Associate,Full-time,Information Technology,Staffing and Recruiting
Data Analyst,data analyst,Luxoft,"Los Angeles, CA",47 minutes ago,52 applicants,Mid-Senior level,Full-time,Consulting,IT Services and IT Consulting
Junior Data analyst,data analyst,"Global Channel Management, Inc.","Framingham, MA",20 hours ago,,Entry level,Full-time,Information Technology,Staffing and Recruiting
Junior Data Analyst,data analyst,Patterned Learning Career,"Boise, ID",6 hours ago,,Not Applicable,Full-time,Information Technology,IT Services and IT Consulting
Business Data Analyst,data analyst,Federal Energy Regulatory Commission,United States,21 hours ago,,Mid-Senior level,Full-time,Analyst,Government Administration
Junior Data Analyst,data analyst,Henry Hire Solutions,United States,21 hours ago,,Entry level,Full-time,Information Technology,Staffing and Recruiting
Data Analyst,data analyst,Circadia Health,"El Segundo, CA",14 hours ago,,Associate,Full-time,Analyst and Information Technology,Medical Equipment Manufacturing and Nursing Homes and Residential Care Facilities
Data Analyst,data analyst,Euclid Beverage,"Newark, IL",3 hours ago,53 applicants,Mid-Senior level,Full-time,Information Technology,Food and Beverage Services
"Senior Data Analyst, Strategic Pricing",data analyst,Realtor.com,"Austin, TX",5 hours ago,,Not Applicable,Full-time,Information Technology,"IT Services and IT Consulting, Advertising Services, and Technology, Information and Internet"
Data Analyst,data analyst,Federal Express Corporation,"Plano, TX",19 hours ago,,Entry level,Full-time,Information Technology,Freight and Package Transportation
Data Analyst,data analyst,Inovalon,"Bowie, MD",16 hours ago,,Entry level,Full-time,Information Technology,Software Development
Senior Data Analyst,data analyst,Aditi Consulting,United States,14 hours ago,,Mid-Senior level,Full-time,Information Technology,IT Services and IT Consulting and Insurance
Clinical Data Analyst,data analyst,TALENT Software Services,"New Hyde Park, NY",18 hours ago,,Mid-Senior level,Full-time,Analyst and Science,Hospitals and Health Care
Strategic Data Analyst,data analyst,Sanford Barrows Group,"Miami, FL",20 hours ago,,Mid-Senior level,Full-time,Analyst and Strategy/Planning,Banking and Financial Services
Retail Banking Data Analyst,data analyst,Kearny Bank,"Fairfield, NJ",12 hours ago,,Entry level,Full-time,Information Technology,Banking
Data Quality Analyst I,data analyst,Tatari,"San Francisco, CA",4 hours ago,,Entry level,Full-time,Information Technology,Advertising Services
Data Analyst,data analyst,Marathon TS,"Sterling, VA",20 hours ago,,Mid-Senior level,Full-time,Information Technology,IT Services and IT Consulting
Data Analyst,data analyst,NYC Department of Health and Mental Hygiene,"Queens, NY",2 hours ago,,Entry level,Full-time,Information Technology,Hospitals and Health Care
Data Analyst - Insurance - REMOTE,data analyst,WAHVE LLC,"Portland, OR",14 hours ago,,Mid-Senior level,Full-time,Information Technology,Staffing and Recruiting
Data Analyst (Junior Data Scientist),data analyst,Swooped,United States,22 hours ago,,Entry level,Full-time,Analyst and Consulting,"Computer and Network Security and Technology, Information and Media"
Data Analyst III (Remote),data analyst,Availity,United States,22 hours ago,,Mid-Senior level,Full-time,Engineering,IT Services and IT Consulting
Data Analyst,data analyst,Guidehouse,"Baltimore, MD",16 hours ago,59 applicants,Associate,Full-time,Information Technology,Business Consulting and Services
Data Analyst - Insurance - REMOTE,data analyst,WAHVE LLC,"Tampa, FL",14 hours ago,,Mid-Senior level,Full-time,Information Technology,Staffing and Recruiting
Data Operations Analyst,data analyst,Curinos,"Chicago, IL",9 hours ago,43 applicants,Associate,Full-time,Management and Manufacturing,Financial Services
"Data Engineer, Analytics",data analyst,Meta,"New York, NY",5 hours ago,,Not Applicable,Full-time,Information Technology,"Technology, Information and Internet"
Sr. Data Analyst,data analyst,Home Solutions,"Raleigh, NC",13 hours ago,,Mid-Senior level,Full-time,Information Technology,"Technology, Information and Internet"
Data Analyst - Insurance - REMOTE,data analyst,WAHVE LLC,"Los Angeles, CA",14 hours ago,,Mid-Senior level,Full-time,Information Technology,Staffing and Recruiting
Ad Ops Data Analyst,data analyst,AdMedia,United States,3 hours ago,96 applicants,Mid-Senior level,Full-time,"Strategy/Planning, Advertising, and Analyst","Advertising Services and Technology, Information and Internet"
Production Support Data Analyst,data analyst,"TechKnowLogic Minds, LLC","New York, NY",12 hours ago,,Mid-Senior level,Full-time,Information Technology,IT Services and IT Consulting
Data Analyst - Insurance - REMOTE,data analyst,WAHVE LLC,"Raleigh, NC",14 hours ago,,Mid-Senior level,Full-time,Information Technology,Staffing and Recruiting
Data Analyst - Insurance - REMOTE,data analyst,WAHVE LLC,"New York, NY",14 hours ago,,Mid-Senior level,Full-time,Information Technology,Staffing and Recruiting
Data Analyst - Insurance - REMOTE,data analyst,WAHVE LLC,"Las Vegas, NV",14 hours ago,,Mid-Senior level,Full-time,Information Technology,Staffing and Recruiting
"Senior Data Analyst, Product",data analyst,AllTrails,United States,14 hours ago,,Not Applicable,Full-time,Information Technology,"Technology, Information and Internet"
Sr. Data Analyst,data analyst,Sedgwick,"Tennessee, United States",17 hours ago,42 applicants,Mid-Senior level,Full-time,Information Technology,Insurance
BI Reporting Analyst III: 24-02132,data analyst,"Akraya, Inc.","Mountain View, CA",19 hours ago,153 applicants,Mid-Senior level,Full-time,"Research, Analyst, and Information Technology",Staffing and Recruiting
Data Analyst - Insurance - REMOTE,data analyst,WAHVE LLC,"Philadelphia, PA",14 hours ago,,Mid-Senior level,Full-time,Information Technology,Staffing and Recruiting
Data Product Analyst,data analyst,Capital Group,"Los Angeles, CA",17 hours ago,148 applicants,Not Applicable,Full-time,"Research, Analyst, and Information Technology",Financial Services and Investment Management
data analyst,data analyst,Robert Half,"Baton Rouge, LA",18 hours ago,,Entry level,Full-time,Information Technology,Staffing and Recruiting
"Data Analyst, Global Tax Services",data analyst,Amazon,"New York, United States",21 hours ago,73 applicants,Not Applicable,Full-time,"Finance, Information Technology, and Accounting/Auditing",Software Development
Sr. Enterprise Data Analyst,data analyst,Under Armour,"Baltimore, MD",5 hours ago,,Mid-Senior level,Full-time,Information Technology,"Advertising Services, Manufacturing, and Retail"
Data Analyst - Insurance - REMOTE,data analyst,WAHVE LLC,"Minneapolis, MN",14 hours ago,,Mid-Senior level,Full-time,Information Technology,Staffing and Recruiting
"Data Engineer, Analytics",data analyst,Meta,"Washington, DC",5 hours ago,,Not Applicable,Full-time,Information Technology,"Technology, Information and Internet"
Data Engineer,data analyst,Verition Fund Management LLC,"New York, NY",20 hours ago,,Mid-Senior level,Full-time,Information Technology,"Technology, Information and Internet"
Senior Data Analyst,data analyst,Epsilon,"Atlanta, GA",5 hours ago,,Mid-Senior level,Full-time,Marketing,"IT Services and IT Consulting, Advertising Services, and Software Development"
Marketing Data Analyst,data analyst,Jooble,"Vancouver, WA",6 hours ago,56 applicants,Entry level,Full-time,Information Technology,"Technology, Information and Internet"
Marketing Data Analyst,data analyst,Jooble,"Fairview, OR",4 hours ago,39 applicants,Entry level,Full-time,Information Technology,"Technology, Information and Internet"
Senior Data Analyst,data analyst,Epsilon,"Irving, TX",5 hours ago,,Mid-Senior level,Full-time,Marketing,"IT Services and IT Consulting, Advertising Services, and Software Development"
AML Data Analyst,data analyst,Randstad USA,"Charlotte, NC",22 hours ago,,Not Applicable,Full-time,Information Technology,Staffing and Recruiting
Data Analyst,data analyst,Dice,United States,22 hours ago,64 applicants,Entry level,Full-time,Information Technology,Software Development
Data Analyst,data analyst,Uline,"Pleasant Prairie, WI",5 hours ago,,Entry level,Full-time,"Analyst, Finance, and Strategy/Planning",Wholesale
"Data Engineer- up to $160,000 + Bonuses",data analyst,Saragossa,"Boston, MA",17 hours ago,187 applicants,Associate,Full-time,"Information Technology, Engineering, and Finance",IT Services and IT Consulting and Financial Services
Compliance Data Analyst (B4),data analyst,Applied Materials,"Santa Clara, CA",3 hours ago,,Not Applicable,Full-time,Information Technology,"Appliances, Electrical, and Electronics Manufacturing, Nanotechnology Research, and Semiconductor Manufacturing"
Senior Data Science Analyst,data analyst,Discover Financial Services,"Riverwoods, IL",4 hours ago,,Mid-Senior level,Full-time,Information Technology,"Banking, Financial Services, and Hospitality"
Business Intelligence Analyst I,data analyst,Avnet,"Phoenix, AZ",15 hours ago,116 applicants,Entry level,Full-time,"Research, Analyst, and Information Technology",IT Services and IT Consulting
Technical Data Analyst,data analyst,"KBR, Inc.","Cambridge, MA",22 hours ago,52 applicants,Mid-Senior level,Full-time,Information Technology,IT Services and IT Consulting
"Senior Analyst, Business Intelligence",data analyst,Magnite,"New York, NY",16 hours ago,88 applicants,Mid-Senior level,Full-time,"Research, Analyst, and Information Technology",Advertising Services
Senior Pharmacy Data Analyst - Remote,data analyst,Clearway Health,United States,16 hours ago,71 applicants,Mid-Senior level,Full-time,Information Technology,Hospitals and Health Care
Data Analyst,data analyst,Dice,"Getzville, NY",22 hours ago,,Mid-Senior level,Full-time,Information Technology,Software Development
GIS Analyst  II,data analyst,ALTAMIRA,"Houston, TX",19 hours ago,,Associate,Full-time,Consulting and Other,Oil and Gas
Data Engineer,data analyst,Franklin Fitch,"Manhattan, NY",4 hours ago,100 applicants,Mid-Senior level,Full-time,Information Technology,Legal Services
Data/Reporting Analyst,data analyst,Randstad USA,"Charlotte, NC",10 hours ago,,Not Applicable,Full-time,"Research, Analyst, and Information Technology",Staffing and Recruiting
Data Engineer,data analyst,Reebelo,United States,4 hours ago,,Mid-Senior level,Full-time,Information Technology and Engineering,Internet Marketplace Platforms and Retail
Data Integration Analyst - Remote,data analyst,Mayo Clinic,"Rochester, MN",4 hours ago,,Mid-Senior level,Full-time,Information Technology,Hospitals and Health Care
Expression of Interest - Data Analyst,data analyst,Oil and Gas Job Search Ltd,"Houston, TX",18 hours ago,,Mid-Senior level,Full-time,Information Technology,Oil and Gas
Reporting Analyst,data analyst,Genesis10,"Eagan, MN",17 hours ago,26 applicants,Mid-Senior level,Full-time,Other,IT Services and IT Consulting
"DATA ANALYST III (POWER BI , HEALTHCARE)",data analyst,Dice,"Palos Verdes Estates, CA",22 hours ago,,Mid-Senior level,Full-time,Information Technology,Software Development
"DATA ANALYST III (POWER BI , HEALTHCARE)",data analyst,Dice,"Los Angeles, CA",22 hours ago,,Mid-Senior level,Full-time,Information Technology,Software Development
Data Engineer,data analyst,VanderHouwen,"Portland, Oregon Metropolitan Area",22 hours ago,,Mid-Senior level,Full-time,Engineering and Information Technology,"Non-profit Organizations and Technology, Information and Media"
"Data Engineer, Product Analytics",data analyst,Meta,"New York, NY",5 hours ago,147 applicants,Not Applicable,Full-time,Information Technology,"Technology, Information and Internet"
"Data Engineer, Product Analytics",data analyst,Meta,"San Francisco, CA",5 hours ago,82 applicants,Not Applicable,Full-time,Information Technology,"Technology, Information and Internet"
"Analyst, Growth Analytics",data analyst,Lifetouch,United States,13 hours ago,,Mid-Senior level,Full-time,Business Development and Sales,Photography
Consumer Market Insights Analyst,data analyst,Whisker,"Auburn Hills, MI",5 hours ago,133 applicants,Mid-Senior level,Full-time,Business Development and Sales,Manufacturing
Senior Data Analyst - Access Center - Full Time 8 Hour Days (Exempt) (Non-Union),data analyst,Keck Medicine of USC,"Alhambra, CA",10 hours ago,,Mid-Senior level,Full-time,Information Technology,Hospitals and Health Care
"Analyst, Competitive Intelligence",data analyst,Zenith,"New York, NY",18 hours ago,72 applicants,Associate,Full-time,Engineering,Advertising Services
"Analyst, Privacy and Data Governance",data analyst,Applied Materials,"Austin, TX",3 hours ago,,Not Applicable,Full-time,Information Technology,"Appliances, Electrical, and Electronics Manufacturing, Nanotechnology Research, and Semiconductor Manufacturing"
Business System Analyst,data analyst,Seneca Resources,"Vienna, VA",20 hours ago,,Associate,Full-time,Consulting,Financial Services
Business Insights Analyst,data analyst,Reyes Holdings,"Chantilly, VA",14 hours ago,35 applicants,Mid-Senior level,Full-time,"Research, Analyst, and Information Technology",Food and Beverage Services
"Analyst, Data Protection",data analyst,"Bayview Asset Management, LLC","New York, NY",15 hours ago,56 applicants,Entry level,Full-time,Engineering and Information Technology,Financial Services
Senior SQL / Power BI Analyst,data analyst,Uline,"Kenosha, WI",5 hours ago,82 applicants,Mid-Senior level,Full-time,Analyst and Distribution,Wholesale
MARKETING DATA ANALYST,data analyst,Dice,"Gresham, OR",22 hours ago,,Entry level,Full-time,Information Technology,Software Development
Data Analysis Engineer,data analyst,Leidos,"Crane, IN",8 hours ago,,Mid-Senior level,Full-time,Engineering,IT Services and IT Consulting
Data Clenase Analyst- REMOTE,data analyst,Talentify.io,United States,5 hours ago,,Mid-Senior level,Full-time,Information Technology,Staffing and Recruiting
"Data Engineer I, Professional Services, Google Cloud",data analyst,Google,"Austin, TX",5 hours ago,188 applicants,Not Applicable,Full-time,"Project Management, Consulting, and Engineering","Information Services and Technology, Information and Internet"
"Sr. Analyst, Data Governance",data analyst,ConocoPhillips,"Houston, TX",22 hours ago,,Mid-Senior level,Full-time,Information Technology,Oil and Gas
"Data Engineer, Product Analytics",data analyst,Meta,"Burlingame, CA",5 hours ago,38 applicants,Not Applicable,Full-time,Information Technology,"Technology, Information and Internet"
Data Analyst - Patient Logistics - Transfer System,data analyst,MercyOne,"Clive, IA",15 hours ago,71 applicants,Entry level,Full-time,Information Technology,Hospitals and Health Care
Senior SQL / Power BI Analyst,data analyst,Uline,"Pleasant Prairie, WI",5 hours ago,95 applicants,Mid-Senior level,Full-time,Analyst and Distribution,Wholesale
Remote Opportunity for Data Input Operator,data analyst,Dapco Video,"Massachusetts, United States",11 hours ago,,Not Applicable,Full-time,Information Technology,Media Production
Data Engineer,data analyst,iHeartMedia,"New York, NY",15 hours ago,158 applicants,Mid-Senior level,Full-time,Information Technology,Broadcast Media Production and Distribution
Quantitative Researcher,data analyst,Coda Search│Staffing,"New York, NY",18 hours ago,80 applicants,Mid-Senior level,Full-time,Finance,Financial Services
Data Analyst - Employee Benefits,data analyst,"Alera Group, Inc.","Norwell, MA",3 hours ago,,Not Applicable,Full-time,Information Technology,Insurance
"Data Engineer, Product Analytics",data analyst,Meta,"Austin, TX",5 hours ago,97 applicants,Not Applicable,Full-time,Information Technology,"Technology, Information and Internet"
Human Resources Data Reporting Analyst,data analyst,City of Atlanta,"Atlanta, GA",18 hours ago,81 applicants,Mid-Senior level,Full-time,Information Technology,Government Administration
Senior Data & Analytics Specialist,data analyst,Hiscox,"Atlanta, GA",5 hours ago,170 applicants,Mid-Senior level,Full-time,Information Technology,Insurance
Clinical Data Analyst,data analyst,"TSR Consulting Services, Inc.","North New Hyde Park, NY",17 hours ago,,Mid-Senior level,Full-time,Information Technology,Staffing and Recruiting
Data Analyst - Security Clearance Required - Remote | WFH,data analyst,Get It Recruit - Information Technology,"Huntsville, AL",17 hours ago,,Mid-Senior level,Full-time,Information Technology,Human Resources Services
Data/Reporting Analyst (DPW Fleet Services),data analyst,City of Atlanta,"Atlanta, GA",18 hours ago,,Mid-Senior level,Full-time,"Research, Analyst, and Information Technology",Government Administration
Administrative Assistant / Data Analyst Supporting the ATF,data analyst,FSA,"Washington, DC",2 hours ago,,Entry level,Full-time,Administrative,Government Administration
Senior SQL / Power BI Analyst,data analyst,Uline,"Milwaukee, WI",5 hours ago,85 applicants,Mid-Senior level,Full-time,Analyst and Distribution,Wholesale
Statistical Data Sciences and Analytics (SAS programmer) - Associate,data analyst,Pfizer,"Pearl River, NY",16 hours ago,,Associate,Full-time,Engineering and Information Technology,Pharmaceutical Manufacturing
"Senior Data Analyst, Cash App Compliance - Remote | WFH",data analyst,Get It Recruit - Finance,"Oakland, CA",17 hours ago,,Mid-Senior level,Full-time,Information Technology,Human Resources Services
Data Management Analyst,data analyst,"Modern Technology Solutions, Inc. (MTSI)","Huntsville, AL",5 hours ago,56 applicants,Entry level,Full-time,"General Business, Analyst, and Engineering","Defense and Space Manufacturing, Aviation and Aerospace Component Manufacturing, and Armed Forces"
Data Engineer,data analyst,Capleo Global,"Indianapolis, IN",20 hours ago,,Mid-Senior level,Full-time,Information Technology,Business Consulting and Services
Data Engineer,data analyst,Provation,United States,18 hours ago,,Not Applicable,Full-time,Information Technology,Information Technology & Services
"ICM Data Analyst, Assistant Vice President (C-12)",data analyst,Citi,"Tampa, FL",5 hours ago,129 applicants,Not Applicable,Full-time,Information Technology,"Banking, Financial Services, and Investment Banking"
Business Intelligence Engineer,data analyst,Amazon,"Cupertino, CA",4 hours ago,,Not Applicable,Full-time,"Strategy/Planning, Analyst, and Information Technology",Software Development
MARKETING DATA ANALYST,data analyst,Dice,"Vancouver, WA",22 hours ago,,Entry level,Full-time,Information Technology,Software Development
Data Engineer (Minneapolis onsite),data analyst,SkyWater Search Partners,"Minneapolis, MN",17 hours ago,,Mid-Senior level,Full-time,Information Technology,Staffing and Recruiting
Data Center Engineer,data analyst,Insight Global,"Austin, Texas Metropolitan Area",23 hours ago,76 applicants,Mid-Senior level,Full-time,Engineering,Data Infrastructure and Analytics
"Data Engineer, Product Analytics",data analyst,Meta,"New York, NY",5 hours ago,51 applicants,Not Applicable,Full-time,Information Technology,"Technology, Information and Internet"
"Sr. Analyst, Campaign Targeting and Analytics",data analyst,BMO U.S.,"Chicago, IL",5 hours ago,91 applicants,Not Applicable,Full-time,Marketing and Sales,Banking
Data Engineer,data analyst,Provation,"Minneapolis, MN",18 hours ago,174 applicants,Not Applicable,Full-time,Information Technology,Information Technology & Services
Data Engineer,data analyst,CubeSmart,"Malvern, PA",4 hours ago,67 applicants,Entry level,Full-time,Information Technology,Real Estate
"Staff/Principal Data Scientist, Research",data analyst,Pendulum Therapeutics,"San Francisco, CA",14 hours ago,,Not Applicable,Full-time,Engineering and Information Technology,Biotechnology
"Data Engineer, Product Analytics",data analyst,Meta,"Burlingame, CA",5 hours ago,56 applicants,Not Applicable,Full-time,Information Technology,"Technology, Information and Internet"
Data Engineer,data analyst,Home Solutions,Charlotte Metro,23 hours ago,,Mid-Senior level,Full-time,Information Technology,Marketing Services and Advertising Services
